{
  "$schema": "http://json-schema.org/draft-07/schema#",
  "$id": "https://example.invalid/schema/race.schema.json",
  "title": "Race",
  "description": "One contest for elected office on a tracked ballot, comparing its candidates side by side. Candidates link to full profiles in content/people/ through candidates[].person_id. scripts/validate.mjs validates against this file, so adding or changing a field means editing this file only.",
  "type": "object",
  "required": [
    "id",
    "office",
    "level",
    "election_date",
    "ballot_order",
    "summary",
    "candidates",
    "key_differences",
    "sources",
    "last_updated"
  ],
  "properties": {
    "id": {
      "description": "Unique kebab-case identifier, also the output filename. Use <jurisdiction>-<office>-<year>, e.g. ca-governor-2026 or us-house-ca-16-2026.",
      "type": "string",
      "minLength": 1,
      "pattern": "^[a-z0-9]+(-[a-z0-9]+)*$"
    },
    "office": {
      "description": "The office being contested, e.g. \"Governor\" or \"U.S. House, California District 16\".",
      "type": "string",
      "minLength": 1
    },
    "level": {
      "description": "Which level of government the office belongs to. Decides where the race is grouped on the landing page.",
      "type": "string",
      "enum": [
        "federal",
        "state",
        "county",
        "local"
      ]
    },
    "election_date": {
      "description": "Date of the general election, as YYYY-MM-DD.",
      "type": "string",
      "pattern": "^[0-9]{4}-[0-9]{2}-[0-9]{2}$"
    },
    "ballot_order": {
      "description": "Position on the ballot, following California Elections Code 13109: 1 Governor, 2 Lieutenant Governor, 3 Secretary of State, 4 Controller, 5 Treasurer, 6 Attorney General, 7 Insurance Commissioner, 8 Board of Equalization, 9 U.S. Senator, 10 U.S. Representative, 11 State Senator, 12 Member of the Assembly, 13 county committee, 14 judicial, 15 Superintendent of Public Instruction, 16 other school offices, 17 county, 18 city, 19 district. The landing page lists races in this order.",
      "type": "number"
    },
    "summary": {
      "description": "One paragraph: what the office does, whether the seat is open, and how the candidates got to the general election.",
      "type": "string",
      "minLength": 1
    },
    "candidates": {
      "description": "Everyone on the general-election ballot for this office.",
      "type": "array",
      "minItems": 1,
      "items": {
        "type": "object",
        "required": [
          "name",
          "party",
          "incumbent",
          "positions"
        ],
        "properties": {
          "name": {
            "type": "string",
            "minLength": 1
          },
          "person_id": {
            "description": "Id of this candidate's profile in content/people/. Omit if no profile exists yet; the name still renders, just without a link.",
            "type": "string",
            "pattern": "^[a-z0-9]+(-[a-z0-9]+)*$"
          },
          "party": {
            "type": "string",
            "minLength": 1
          },
          "incumbent": {
            "type": "boolean"
          },
          "primary_result": {
            "description": "How they did in the primary, e.g. \"First place, 19.1%\". Omit if no certified or reported figure was found.",
            "type": "string",
            "minLength": 1
          },
          "positions": {
            "description": "Their stated stance on the issues that define this race, each a concrete claim attributable to a source.",
            "type": "array",
            "items": {
              "type": "object",
              "required": [
                "issue",
                "stance"
              ],
              "properties": {
                "issue": {
                  "type": "string",
                  "minLength": 1
                },
                "stance": {
                  "type": "string",
                  "minLength": 1
                }
              }
            }
          }
        }
      }
    },
    "key_differences": {
      "description": "Where the candidates actually disagree, in plain language. One string per difference.",
      "type": "array",
      "items": {
        "type": "string",
        "minLength": 1
      }
    },
    "polling": {
      "description": "Published general-election polls. Omit or leave empty if none were found.",
      "type": "array",
      "items": {
        "type": "object",
        "required": [
          "pollster",
          "dates",
          "result",
          "url"
        ],
        "properties": {
          "pollster": {
            "type": "string",
            "minLength": 1
          },
          "dates": {
            "type": "string",
            "minLength": 1
          },
          "result": {
            "type": "string",
            "minLength": 1
          },
          "url": {
            "type": "string",
            "minLength": 1
          }
        }
      }
    },
    "sources": {
      "description": "Sources this race page rests on.",
      "type": "array",
      "minItems": 1,
      "items": {
        "type": "object",
        "required": [
          "title",
          "url",
          "retrieved"
        ],
        "properties": {
          "title": {
            "type": "string",
            "minLength": 1
          },
          "url": {
            "type": "string",
            "minLength": 1
          },
          "retrieved": {
            "type": "string",
            "pattern": "^[0-9]{4}-[0-9]{2}-[0-9]{2}$"
          }
        }
      }
    },
    "last_updated": {
      "description": "Date this file was last edited by a human, as YYYY-MM-DD.",
      "type": "string",
      "pattern": "^[0-9]{4}-[0-9]{2}-[0-9]{2}$"
    }
  }
}
