{
  "id": "ca-assembly-28-2026",
  "office": "State Assembly, District 28",
  "level": "state",
  "election_date": "2026-11-03",
  "ballot_order": 12,
  "summary": "Assembly District 28 spans parts of Santa Cruz and Santa Clara counties. Incumbent Democrat Gail Pellerin, Santa Cruz County's former longtime chief elections officer, was first elected in 2022 and re-elected in 2024 with 66.9%. In the June 2 primary she took 72.0%; Republican Carol Pefley, a former journalist and realtor, took 28.0%.",
  "candidates": [
    {
      "name": "Gail Pellerin",
      "person_id": "gail-pellerin",
      "party": "Democratic",
      "incumbent": true,
      "primary_result": "First place, 72.0% (94,902 votes)",
      "positions": [
        {
          "issue": "Elections",
          "stance": "Co-authored AB 2839, the 2024 law restricting deceptive AI deepfakes near an election, which a federal court has since blocked. See her profile for her full legislative record. (leginfo.legislature.ca.gov)"
        }
      ]
    },
    {
      "name": "Carol Pefley",
      "person_id": "carol-pefley",
      "party": "Republican",
      "incumbent": false,
      "primary_result": "Second place, 28.0% (36,949 votes)",
      "positions": [
        {
          "issue": "Housing",
          "stance": "Wants to revise recent state housing laws to protect the character of Santa Cruz. (Lookout Santa Cruz op-ed, September 2026)"
        }
      ]
    }
  ],
  "key_differences": [
    "Pefley's campaign centers on rolling back recent state housing laws. This research did not compile Pellerin's housing votes, so check her profile and roll calls before treating the contrast as settled.",
    "Through May 16, 2026, Pellerin reported about $422,000 in contributions. Pefley reported about $47,000 plus a $10,000 loan (Transparency USA).",
    "The district is safely Democratic by registration and recent results."
  ],
  "sources": [
    {
      "title": "Ballotpedia: Carol Pefley (certified primary results)",
      "url": "https://ballotpedia.org/Carol_Pefley",
      "retrieved": "2026-10-25"
    },
    {
      "title": "Lookout Santa Cruz: I'm running against Gail Pellerin (Carol Pefley op-ed)",
      "url": "https://lookout.co/im-running-against-gail-pellerin-we-need-to-hold-onto-the-heart-of-santa-cruz-by-revising-recent-housing-laws/story",
      "retrieved": "2026-10-25"
    },
    {
      "title": "Transparency USA: California State Assembly District 28 election",
      "url": "https://www.transparencyusa.org/ca/race/california-state-assembly-district-28-71544",
      "retrieved": "2026-10-25"
    },
    {
      "title": "CalMatters Digital Democracy: Gail Pellerin",
      "url": "https://calmatters.digitaldemocracy.org/legislators/gail-pellerin-149519",
      "retrieved": "2026-10-25"
    }
  ],
  "last_updated": "2026-10-25"
}
