{
  "id": "ca-governor-2026",
  "office": "Governor",
  "level": "state",
  "election_date": "2026-11-03",
  "ballot_order": 1,
  "summary": "The governor runs the executive branch, proposes the state budget, signs or vetoes bills, and appoints judges and hundreds of officials. The seat is open: Gavin Newsom is term-limited. In the June 2 top-two primary, Democrat Xavier Becerra (former U.S. Health and Human Services Secretary and former state Attorney General) placed first with 27.98% and Republican Steve Hilton (former adviser to UK Prime Minister David Cameron and former Fox News host) placed second with 24.59%, edging out Democrat Tom Steyer (22.79%), who spent heavily from his own fortune and later endorsed Becerra. Republicans have not won a California governor's race since 2006.",
  "candidates": [
    {
      "name": "Xavier Becerra",
      "person_id": "xavier-becerra",
      "party": "Democratic",
      "incumbent": false,
      "primary_result": "First place, 27.98% (2,591,857 votes)",
      "positions": [
        {
          "issue": "Taxes",
          "stance": "Supports a progressive income tax and extending the higher rate on high earners to fund schools; opposes Proposition 40, the billionaire wealth tax; has not ruled out raising taxes and would tax corporations whose workers qualify for public health coverage. (CalMatters voter guide)"
        },
        {
          "issue": "Housing",
          "stance": "Would declare a state of emergency to finance about 40,000 approved but unfunded affordable units, push cities to zone for more homes, expand down-payment assistance, and curb large corporations buying homes in bulk. (CalMatters)"
        },
        {
          "issue": "Homelessness",
          "stance": "Would create ongoing state rental-assistance funding and a public dashboard of state-funded units; says people should not voluntarily stay on the street when offered shelter but stops short of supporting arrests. (CalMatters)"
        },
        {
          "issue": "Cost of living and energy",
          "stance": "Would declare a state of emergency to freeze utility and insurance rates and crack down on price gouging; supports the state's clean-energy goals but is open to revising them, including the 2035 ban on new gas-car sales, if they make energy unaffordable. (CalMatters)"
        },
        {
          "issue": "Immigration",
          "stance": "Supports California's sanctuary law, which he defended in court as Attorney General. (CalMatters)"
        },
        {
          "issue": "Health care",
          "stance": "Former single-payer supporter; now backs expanding coverage to as many residents as possible, cutting insurer administrative spending, and requiring more telehealth coverage. (CalMatters)"
        },
        {
          "issue": "Federal government",
          "stance": "Makes confronting the Trump administration central to his campaign, citing the more than 100 lawsuits he filed against the first Trump administration as Attorney General. (CalMatters)"
        }
      ]
    },
    {
      "name": "Steve Hilton",
      "person_id": "steve-hilton",
      "party": "Republican",
      "incumbent": false,
      "primary_result": "Second place, 24.59% (2,277,318 votes)",
      "positions": [
        {
          "issue": "Taxes",
          "stance": "Would eliminate state income tax on the first $150,000 of earnings with a flat rate above that, halve the gas tax, and eliminate the $800 minimum business registration fee; opposes Proposition 40. (CalMatters voter guide)"
        },
        {
          "issue": "Housing",
          "stance": "Aims to 'bring back the starter home' by cutting fees and building rules for small single-family homes, create a state loan program for first-time buyers, and limit CEQA lawsuits; favors suburban development over dense city apartments. (CalMatters)"
        },
        {
          "issue": "Homelessness",
          "stance": "Treats street camping as illegal and wants police involved in clearing all encampments; would prioritize sober housing over low-barrier shelters. (CalMatters)"
        },
        {
          "issue": "Energy",
          "stance": "Would suspend environmental regulations to lower gas prices (campaign target: $3 a gallon), end mandates requiring utilities to buy solar and wind power, and expand natural gas production. (CalMatters; Wikipedia)"
        },
        {
          "issue": "Immigration and public safety",
          "stance": "Would overturn the sanctuary law, reopen closed prisons, reduce good-conduct early releases, and loosen firearm restrictions. (CalMatters)"
        },
        {
          "issue": "Health care",
          "stance": "Would end state-funded Medi-Cal coverage for undocumented immigrants and redirect the money to lowering costs for legal residents. (CalMatters)"
        },
        {
          "issue": "Federal government",
          "stance": "Endorsed by President Trump on April 6, 2026; says a cooperative relationship would help California secure federal funds. (CalMatters; Wikipedia)"
        }
      ]
    }
  ],
  "key_differences": [
    "Hilton would exempt the first $150,000 of income from state income tax. Becerra would keep the progressive system and extend the higher top rate. At their CNN debate, Becerra called Hilton's plan a large tax cut for the wealthiest.",
    "Hilton would suspend environmental rules and end renewable-purchase mandates to cut gas and power prices. Becerra would keep the clean-energy goals but says he would revisit them, including the 2035 gas-car phase-out, if costs spike.",
    "Becerra would keep the sanctuary law he defended in court. Hilton would repeal it and end Medi-Cal for undocumented adults.",
    "Hilton would have police clear every encampment and favors sober housing. Becerra emphasizes rental assistance and does not back arrests.",
    "Hilton is endorsed by Trump and promises to cooperate with his administration. Becerra is running as the state's defender against it."
  ],
  "polling": [
    {
      "pollster": "Emerson College",
      "dates": "October 17 to 19, 2026 (1,000 likely voters, ±3.1)",
      "result": "Becerra 60%, Hilton 33%; with leaners, Becerra 64%, Hilton 36%. Among independents, Becerra 46%, Hilton 36%.",
      "url": "https://www.courthousenews.com/poll-gives-becerra-27-point-lead-over-hilton-in-california-governor-race/"
    },
    {
      "pollster": "Berkeley IGS",
      "dates": "Most recent before October 25, 2026 (likely voters)",
      "result": "Becerra 58%, Hilton 33%, as reported by MultiState; exact field dates not confirmed in this session.",
      "url": "https://www.multistate.us/elections/governor-race/california-2026"
    }
  ],
  "sources": [
    {
      "title": "CalMatters 2026 voter guide: Governor",
      "url": "https://calmatters.org/california-voter-guide-2026/governor/",
      "retrieved": "2026-10-25"
    },
    {
      "title": "CalMatters: Steve Hilton to face Becerra in November election",
      "url": "https://calmatters.org/politics/2026/06/california-governor-primary-hilton-advances/",
      "retrieved": "2026-10-25"
    },
    {
      "title": "Wikipedia: 2026 California gubernatorial election (certified primary statement of vote)",
      "url": "https://en.wikipedia.org/wiki/2026_California_gubernatorial_election",
      "retrieved": "2026-10-25"
    },
    {
      "title": "MultiState: California Governor Race 2026, Becerra vs. Hilton",
      "url": "https://www.multistate.us/elections/governor-race/california-2026",
      "retrieved": "2026-10-25"
    },
    {
      "title": "Courthouse News: Poll gives Becerra 27-point lead over Hilton",
      "url": "https://www.courthousenews.com/poll-gives-becerra-27-point-lead-over-hilton-in-california-governor-race/",
      "retrieved": "2026-10-25"
    }
  ],
  "last_updated": "2026-10-25"
}
